{
  "protocol_version": "1.0",
  "export_id": "day-014",
  "history_version": 1,
  "exported_at": "2026-08-16T18:35:09.694155Z",
  "date": "2026-07-05",
  "day_number": 14,
  "provenance": {
    "source": "chat_history",
    "confidence": "low",
    "notes": "Only morning weight is available. 日期根据 Day 43 = 2026-08-03 且期间连续无中断推算为 2026-07-05；日期已按连续无中断记录确认。"
  },
  "body": {
    "weight_kg": 81.45,
    "waist_cm": 87,
    "body_fat_percentage": null,
    "notes": "腰围沿用 Day 8 的最近测量值：87 cm。"
  },
  "daily_log": {
    "is_training_day": true,
    "workout_type": "cardio_walking_yardwork",
    "calories_in": 1908,
    "tdee": 2475,
    "calorie_balance": -567,
    "protein_g": 115,
    "total_carbs_g": 169,
    "fiber_g": 0,
    "net_carbs_g": 169,
    "fat_g": 83.5,
    "steps": null,
    "active_energy_kcal": 675,
    "notes": "有氧 + 快走 + Yard work；具体时长、速度和距离未提供；nutrition_history.json 逐项饮食明细已补充；膳食纤维暂按 0 g。"
  },
  "nutrition": [
    {
      "entry_id": "D014_F001",
      "meal_type": "noon",
      "food_name": "生米",
      "brand": null,
      "amount": 130,
      "unit": "g",
      "servings": null,
      "calories": 360,
      "protein_g": 7.69,
      "total_carbs_g": 77.69,
      "fiber_g": 0,
      "net_carbs_g": 77.69,
      "fat_g": 0.62,
      "notes": null
    },
    {
      "entry_id": "D014_F002",
      "meal_type": "noon",
      "food_name": "Spare Rib",
      "brand": null,
      "amount": 200,
      "unit": "g",
      "servings": null,
      "calories": 250,
      "protein_g": 19,
      "total_carbs_g": 0,
      "fiber_g": 0,
      "net_carbs_g": 0,
      "fat_g": 19,
      "notes": null
    },
    {
      "entry_id": "D014_F003",
      "meal_type": "noon",
      "food_name": "百叶结",
      "brand": null,
      "amount": 50,
      "unit": "g",
      "servings": null,
      "calories": 70,
      "protein_g": 7,
      "total_carbs_g": 4,
      "fiber_g": 0,
      "net_carbs_g": 4,
      "fat_g": 3,
      "notes": null
    },
    {
      "entry_id": "D014_F004",
      "meal_type": "night",
      "food_name": "牛仔骨",
      "brand": null,
      "amount": 120,
      "unit": "g",
      "servings": null,
      "calories": 300,
      "protein_g": 18.33,
      "total_carbs_g": 0,
      "fiber_g": 0,
      "net_carbs_g": 0,
      "fat_g": 25,
      "notes": null
    },
    {
      "entry_id": "D014_F005",
      "meal_type": "snack",
      "food_name": "樱桃",
      "brand": null,
      "amount": 150,
      "unit": "g",
      "servings": null,
      "calories": 63.33,
      "protein_g": 1.07,
      "total_carbs_g": 16,
      "fiber_g": 0,
      "net_carbs_g": 16,
      "fat_g": 0.2,
      "notes": null
    },
    {
      "entry_id": "D014_F006",
      "meal_type": "snack",
      "food_name": "水浸三文鱼罐头",
      "brand": null,
      "amount": 1,
      "unit": "custom",
      "servings": null,
      "calories": 100,
      "protein_g": 21,
      "total_carbs_g": 0,
      "fiber_g": 0,
      "net_carbs_g": 0,
      "fat_g": 1.5,
      "notes": "原始单位：can"
    },
    {
      "entry_id": "D014_F007",
      "meal_type": "snack",
      "food_name": "鸡蛋",
      "brand": null,
      "amount": 2,
      "unit": "piece",
      "servings": null,
      "calories": 70,
      "protein_g": 6,
      "total_carbs_g": 0.5,
      "fiber_g": 0,
      "net_carbs_g": 0.5,
      "fat_g": 5,
      "notes": null
    },
    {
      "entry_id": "D014_F008",
      "meal_type": "snack",
      "food_name": "Ciabatta",
      "brand": null,
      "amount": 1,
      "unit": "piece",
      "servings": null,
      "calories": 210,
      "protein_g": 7,
      "total_carbs_g": 41,
      "fiber_g": 0,
      "net_carbs_g": 41,
      "fat_g": 1.5,
      "notes": null
    }
  ],
  "workout": null,
  "review": [
    {
      "review_status": "needs_review",
      "note": "逐项饮食明细已从 nutrition_history.json 补充；其余历史字段仍需确认。",
      "field": "day.multiple"
    },
    {
      "review_status": "approved",
      "note": "日期已按 Day 43 = 2026-08-03 且期间连续无中断记录确认。",
      "field": "day.date"
    },
    {
      "review_status": "approved",
      "note": "逐项饮食明细已从 nutrition_history.json 补充；已保留原有确认值。",
      "field": "daily_log.nutrition"
    }
  ]
}
