{
  "protocol_version": "1.0",
  "export_id": "day-114",
  "history_version": 12,
  "exported_at": "2026-10-15T15:00:59.075600Z",
  "date": "2026-10-13",
  "day_number": 114,
  "provenance": {
    "source": "xunji_app",
    "confidence": "high",
    "notes": "数据来自训记 Open API；膳食纤维按 0 g，净碳水按总碳水；TDEE 为估算值。"
  },
  "body": null,
  "daily_log": {
    "is_training_day": true,
    "workout_type": "p3_腿",
    "calories_in": null,
    "tdee": 2630.0,
    "calorie_balance": -2630.0,
    "protein_g": null,
    "total_carbs_g": null,
    "fiber_g": 0,
    "net_carbs_g": 0,
    "fat_g": null,
    "steps": null,
    "active_energy_kcal": 809.6,
    "active_energy_source": "estimated",
    "notes": "膳食纤维暂按 0 g；净碳水按总碳水计算；BMR≈1822（Katch-McArdle，按当日体重与最近体脂）。TDEE 的活动部分按训练容量估算 810 kcal（584 + 0.01×容量，由 58 天全天实测拟合）；未手工录入实测值。"
  },
  "nutrition": [],
  "workout": {
    "session_id": "day-114-xunji",
    "workout_name": "P3-腿",
    "workout_type": "p3_腿",
    "duration_minutes": 142.9,
    "active_energy_kcal": null,
    "apple_health_workout_kcal": null,
    "notes": "训练动作来自训记 API；有氧消耗取 sets[].metrics.calories。课次 note 的 calorie 值为苹果健康训练时段消耗，仅记录不参与计算。",
    "exercises": [
      {
        "exercise_name": "史密斯机深蹲",
        "category": "other",
        "muscle_group": null,
        "sets": [
          {
            "set_number": 1,
            "weight": 70.0,
            "reps": 12,
            "rir": null,
            "distance": null,
            "duration_seconds": null,
            "notes": null
          },
          {
            "set_number": 2,
            "weight": 80.0,
            "reps": 8,
            "rir": null,
            "distance": null,
            "duration_seconds": null,
            "notes": null
          },
          {
            "set_number": 3,
            "weight": 90.0,
            "reps": 8,
            "rir": null,
            "distance": null,
            "duration_seconds": null,
            "notes": null
          },
          {
            "set_number": 4,
            "weight": 90.0,
            "reps": 8,
            "rir": null,
            "distance": null,
            "duration_seconds": null,
            "notes": null
          },
          {
            "set_number": 5,
            "weight": 90.0,
            "reps": 8,
            "rir": null,
            "distance": null,
            "duration_seconds": null,
            "notes": null
          },
          {
            "set_number": 6,
            "weight": 90.0,
            "reps": 8,
            "rir": null,
            "distance": null,
            "duration_seconds": null,
            "notes": null
          },
          {
            "set_number": 7,
            "weight": 90.0,
            "reps": 8,
            "rir": null,
            "distance": null,
            "duration_seconds": null,
            "notes": null
          }
        ]
      },
      {
        "exercise_name": "反向哈克早安",
        "category": "other",
        "muscle_group": null,
        "sets": [
          {
            "set_number": 1,
            "weight": 120.0,
            "reps": 10,
            "rir": null,
            "distance": null,
            "duration_seconds": null,
            "notes": null
          },
          {
            "set_number": 2,
            "weight": 140.0,
            "reps": 10,
            "rir": null,
            "distance": null,
            "duration_seconds": null,
            "notes": null
          },
          {
            "set_number": 3,
            "weight": 140.0,
            "reps": 10,
            "rir": null,
            "distance": null,
            "duration_seconds": null,
            "notes": null
          }
        ]
      },
      {
        "exercise_name": "臀冲架臀冲",
        "category": "other",
        "muscle_group": "臀",
        "sets": [
          {
            "set_number": 1,
            "weight": 240.0,
            "reps": 6,
            "rir": null,
            "distance": null,
            "duration_seconds": null,
            "notes": null
          },
          {
            "set_number": 2,
            "weight": 240.0,
            "reps": 6,
            "rir": null,
            "distance": null,
            "duration_seconds": null,
            "notes": null
          },
          {
            "set_number": 3,
            "weight": 220.0,
            "reps": 10,
            "rir": null,
            "distance": null,
            "duration_seconds": null,
            "notes": null
          }
        ]
      },
      {
        "exercise_name": "坐姿腿屈伸",
        "category": "other",
        "muscle_group": "股四头",
        "sets": [
          {
            "set_number": 1,
            "weight": 80.0,
            "reps": 15,
            "rir": null,
            "distance": null,
            "duration_seconds": null,
            "notes": null
          },
          {
            "set_number": 2,
            "weight": 80.0,
            "reps": 15,
            "rir": null,
            "distance": null,
            "duration_seconds": null,
            "notes": null
          },
          {
            "set_number": 3,
            "weight": 80.0,
            "reps": 15,
            "rir": null,
            "distance": null,
            "duration_seconds": null,
            "notes": null
          }
        ]
      },
      {
        "exercise_name": "坐姿髋内收",
        "category": "other",
        "muscle_group": "内收肌",
        "sets": [
          {
            "set_number": 1,
            "weight": 60.0,
            "reps": 15,
            "rir": null,
            "distance": null,
            "duration_seconds": null,
            "notes": null
          },
          {
            "set_number": 2,
            "weight": 60.0,
            "reps": 15,
            "rir": null,
            "distance": null,
            "duration_seconds": null,
            "notes": null
          },
          {
            "set_number": 3,
            "weight": 60.0,
            "reps": 15,
            "rir": null,
            "distance": null,
            "duration_seconds": null,
            "notes": null
          },
          {
            "set_number": 4,
            "weight": 60.0,
            "reps": 15,
            "rir": null,
            "distance": null,
            "duration_seconds": null,
            "notes": null
          }
        ]
      },
      {
        "exercise_name": "下斜卷腹",
        "category": "other",
        "muscle_group": "核心",
        "sets": [
          {
            "set_number": 1,
            "weight": 20.0,
            "reps": 20,
            "rir": null,
            "distance": null,
            "duration_seconds": null,
            "notes": null
          },
          {
            "set_number": 2,
            "weight": 20.0,
            "reps": 20,
            "rir": null,
            "distance": null,
            "duration_seconds": null,
            "notes": null
          },
          {
            "set_number": 3,
            "weight": 20.0,
            "reps": 20,
            "rir": null,
            "distance": null,
            "duration_seconds": null,
            "notes": null
          }
        ]
      },
      {
        "exercise_name": "悬挂抬腿",
        "category": "other",
        "muscle_group": "核心",
        "sets": [
          {
            "set_number": 1,
            "weight": 0.0,
            "reps": 15,
            "rir": null,
            "distance": null,
            "duration_seconds": null,
            "notes": null
          },
          {
            "set_number": 2,
            "weight": 0.0,
            "reps": 15,
            "rir": null,
            "distance": null,
            "duration_seconds": null,
            "notes": null
          },
          {
            "set_number": 3,
            "weight": 0.0,
            "reps": 15,
            "rir": null,
            "distance": null,
            "duration_seconds": null,
            "notes": null
          }
        ]
      }
    ]
  },
  "review": [
    {
      "review_status": "approved",
      "note": "用户确认纤维按 0 g、净碳水等于总碳水，并接受 TDEE 估算。",
      "field": "daily_log"
    }
  ]
}
