{
  "protocol_version": "1.0",
  "export_id": "day-130",
  "history_version": 10,
  "exported_at": "2026-10-31T06:59:03.497492Z",
  "date": "2026-10-29",
  "day_number": 130,
  "provenance": {
    "source": "xunji_app",
    "confidence": "high",
    "notes": "数据来自训记 Open API；膳食纤维按 0 g，净碳水按总碳水；TDEE 为估算值。"
  },
  "body": null,
  "daily_log": {
    "is_training_day": true,
    "workout_type": "推2",
    "calories_in": 484.0,
    "tdee": 2590.0,
    "calorie_balance": -2106.0,
    "protein_g": 56.4,
    "total_carbs_g": 32.3,
    "fiber_g": 0,
    "net_carbs_g": 32.3,
    "fat_g": 14.950000000000001,
    "steps": null,
    "active_energy_kcal": 730.1,
    "active_energy_source": "estimated",
    "notes": "膳食纤维暂按 0 g；净碳水按总碳水计算；BMR≈1856（Katch-McArdle，按当日体重与最近体脂）。TDEE 的活动部分按训练容量估算 730 kcal（584 + 0.01×容量，由 58 天全天实测拟合）；未手工录入实测值。"
  },
  "nutrition": [
    {
      "entry_id": "D130_XJ001",
      "meal_type": "morning",
      "food_name": "凉拌牛腱子肉",
      "brand": null,
      "amount": 250.0,
      "unit": "g",
      "servings": null,
      "calories": 146.0,
      "protein_g": 21.8,
      "total_carbs_g": 1.2,
      "fiber_g": 0,
      "net_carbs_g": 1.2,
      "fat_g": 5.9,
      "notes": "训记 API 营养快照；纤维未由接口返回。"
    },
    {
      "entry_id": "D130_XJ002",
      "meal_type": "morning",
      "food_name": "冬枣",
      "brand": null,
      "amount": 100.0,
      "unit": "g",
      "servings": null,
      "calories": 119.0,
      "protein_g": 1.9,
      "total_carbs_g": 29.3,
      "fiber_g": 0,
      "net_carbs_g": 29.3,
      "fat_g": 0.2,
      "notes": "训记 API 营养快照；纤维未由接口返回。"
    }
  ],
  "workout": {
    "session_id": "day-130-xunji",
    "workout_name": "推2",
    "workout_type": "推2",
    "duration_minutes": 261.9,
    "active_energy_kcal": 304.0,
    "apple_health_workout_kcal": 687.0,
    "notes": "训练动作来自训记 API；有氧消耗取 sets[].metrics.calories。课次 note 的 calorie 值为苹果健康训练时段消耗，仅记录不参与计算。",
    "exercises": [
      {
        "exercise_name": "杠铃卧推",
        "category": "other",
        "muscle_group": "胸",
        "sets": [
          {
            "set_number": 1,
            "weight": 40.0,
            "reps": 12,
            "rir": null,
            "distance": null,
            "duration_seconds": null,
            "notes": null
          },
          {
            "set_number": 2,
            "weight": 60.0,
            "reps": 8,
            "rir": null,
            "distance": null,
            "duration_seconds": null,
            "notes": null
          },
          {
            "set_number": 3,
            "weight": 70.0,
            "reps": 8,
            "rir": null,
            "distance": null,
            "duration_seconds": null,
            "notes": null
          },
          {
            "set_number": 4,
            "weight": 75.0,
            "reps": 8,
            "rir": null,
            "distance": null,
            "duration_seconds": null,
            "notes": null
          },
          {
            "set_number": 5,
            "weight": 75.0,
            "reps": 7,
            "rir": null,
            "distance": null,
            "duration_seconds": null,
            "notes": null
          },
          {
            "set_number": 6,
            "weight": 75.0,
            "reps": 6,
            "rir": null,
            "distance": null,
            "duration_seconds": null,
            "notes": null
          },
          {
            "set_number": 7,
            "weight": 75.0,
            "reps": 6,
            "rir": null,
            "distance": null,
            "duration_seconds": null,
            "notes": null
          }
        ]
      },
      {
        "exercise_name": "上斜哑铃卧推",
        "category": "other",
        "muscle_group": "胸",
        "sets": [
          {
            "set_number": 1,
            "weight": 25.0,
            "reps": 12,
            "rir": null,
            "distance": null,
            "duration_seconds": null,
            "notes": null
          },
          {
            "set_number": 2,
            "weight": 25.0,
            "reps": 12,
            "rir": null,
            "distance": null,
            "duration_seconds": null,
            "notes": null
          },
          {
            "set_number": 3,
            "weight": 25.0,
            "reps": 14,
            "rir": null,
            "distance": null,
            "duration_seconds": null,
            "notes": null
          },
          {
            "set_number": 4,
            "weight": 25.0,
            "reps": 12,
            "rir": null,
            "distance": null,
            "duration_seconds": null,
            "notes": null
          }
        ]
      },
      {
        "exercise_name": "双杠臂屈伸",
        "category": "other",
        "muscle_group": null,
        "sets": [
          {
            "set_number": 1,
            "weight": null,
            "reps": 10,
            "rir": null,
            "distance": null,
            "duration_seconds": null,
            "notes": null
          },
          {
            "set_number": 2,
            "weight": null,
            "reps": 10,
            "rir": null,
            "distance": null,
            "duration_seconds": null,
            "notes": null
          },
          {
            "set_number": 3,
            "weight": null,
            "reps": 11,
            "rir": null,
            "distance": null,
            "duration_seconds": null,
            "notes": null
          }
        ]
      },
      {
        "exercise_name": "悍马机坐姿推举",
        "category": "other",
        "muscle_group": "肩",
        "sets": [
          {
            "set_number": 1,
            "weight": 49.8952,
            "reps": 14,
            "rir": null,
            "distance": null,
            "duration_seconds": null,
            "notes": null
          },
          {
            "set_number": 2,
            "weight": 49.8952,
            "reps": 14,
            "rir": null,
            "distance": null,
            "duration_seconds": null,
            "notes": null
          },
          {
            "set_number": 3,
            "weight": 49.8952,
            "reps": 15,
            "rir": null,
            "distance": null,
            "duration_seconds": null,
            "notes": null
          }
        ]
      },
      {
        "exercise_name": "绳索侧平举（单边）",
        "category": "other",
        "muscle_group": "肩",
        "sets": [
          {
            "set_number": 1,
            "weight": 20.0,
            "reps": 15,
            "rir": null,
            "distance": null,
            "duration_seconds": null,
            "notes": null
          },
          {
            "set_number": 2,
            "weight": 20.0,
            "reps": 15,
            "rir": null,
            "distance": null,
            "duration_seconds": null,
            "notes": null
          },
          {
            "set_number": 3,
            "weight": 25.0,
            "reps": 8,
            "rir": null,
            "distance": null,
            "duration_seconds": null,
            "notes": null
          }
        ]
      },
      {
        "exercise_name": "绳索臂屈伸",
        "category": "other",
        "muscle_group": "三头",
        "sets": [
          {
            "set_number": 1,
            "weight": 55.0,
            "reps": 10,
            "rir": null,
            "distance": null,
            "duration_seconds": null,
            "notes": null
          },
          {
            "set_number": 2,
            "weight": 55.0,
            "reps": 10,
            "rir": null,
            "distance": null,
            "duration_seconds": null,
            "notes": null
          },
          {
            "set_number": 3,
            "weight": 55.0,
            "reps": 10,
            "rir": null,
            "distance": null,
            "duration_seconds": null,
            "notes": null
          }
        ]
      },
      {
        "exercise_name": "绳索过头臂屈伸",
        "category": "other",
        "muscle_group": "三头",
        "sets": [
          {
            "set_number": 1,
            "weight": 60.0,
            "reps": 11,
            "rir": null,
            "distance": null,
            "duration_seconds": null,
            "notes": null
          },
          {
            "set_number": 2,
            "weight": 60.0,
            "reps": 11,
            "rir": null,
            "distance": null,
            "duration_seconds": null,
            "notes": null
          },
          {
            "set_number": 3,
            "weight": 60.0,
            "reps": 10,
            "rir": null,
            "distance": null,
            "duration_seconds": null,
            "notes": null
          },
          {
            "set_number": 4,
            "weight": 60.0,
            "reps": 11,
            "rir": null,
            "distance": null,
            "duration_seconds": null,
            "notes": null
          }
        ]
      },
      {
        "exercise_name": "下斜悍马机推胸",
        "category": "other",
        "muscle_group": "胸",
        "sets": [
          {
            "set_number": 1,
            "weight": 80.0,
            "reps": 11,
            "rir": null,
            "distance": null,
            "duration_seconds": null,
            "notes": null
          },
          {
            "set_number": 2,
            "weight": 80.0,
            "reps": 11,
            "rir": null,
            "distance": null,
            "duration_seconds": null,
            "notes": null
          },
          {
            "set_number": 3,
            "weight": 80.0,
            "reps": 11,
            "rir": null,
            "distance": null,
            "duration_seconds": null,
            "notes": null
          }
        ]
      }
    ]
  },
  "review": [
    {
      "review_status": "approved",
      "note": "用户确认纤维按 0 g、净碳水等于总碳水，并接受 TDEE 估算。",
      "field": "daily_log"
    }
  ]
}
