{
  "protocol_version": "1.0",
  "export_id": "day-086",
  "history_version": 1,
  "exported_at": "2026-09-15T15:02:13.345375Z",
  "date": "2026-09-15",
  "day_number": 86,
  "provenance": {
    "source": "xunji_app",
    "confidence": "high",
    "notes": "数据来自训记 Open API；膳食纤维按 0 g，净碳水按总碳水；TDEE 为估算值。"
  },
  "body": {
    "weight_kg": 78.35,
    "notes": "训记 Open API 身体数据。"
  },
  "daily_log": {
    "is_training_day": false,
    "workout_type": null,
    "calories_in": null,
    "tdee": 2220.0,
    "calorie_balance": -2220.0,
    "protein_g": null,
    "total_carbs_g": null,
    "fiber_g": 0,
    "net_carbs_g": 0,
    "fat_g": null,
    "steps": null,
    "active_energy_kcal": 450.0,
    "active_energy_source": "estimated",
    "notes": "膳食纤维暂按 0 g；净碳水按总碳水计算；BMR≈1773（Katch-McArdle，按当日体重与最近体脂）。TDEE 的活动部分按训练容量估算 450 kcal（584 + 0.01×容量，由 58 天全天实测拟合）；未手工录入实测值。"
  },
  "nutrition": [],
  "workout": null,
  "review": [
    {
      "review_status": "approved",
      "note": "用户确认纤维按 0 g、净碳水等于总碳水，并接受 TDEE 估算。",
      "field": "daily_log"
    }
  ]
}
