{
  "protocol_version": "1.0",
  "export_id": "day-116",
  "history_version": 2,
  "exported_at": "2026-10-16T14:52:01.120817Z",
  "date": "2026-10-15",
  "day_number": 116,
  "provenance": {
    "source": "xunji_app",
    "confidence": "high",
    "notes": "数据来自训记 Open API；膳食纤维按 0 g，净碳水按总碳水；TDEE 为估算值。"
  },
  "body": null,
  "daily_log": {
    "is_training_day": false,
    "workout_type": null,
    "calories_in": null,
    "tdee": 2270.0,
    "calorie_balance": -2270.0,
    "protein_g": null,
    "total_carbs_g": null,
    "fiber_g": 0,
    "net_carbs_g": 0,
    "fat_g": null,
    "steps": null,
    "active_energy_kcal": 450.0,
    "active_energy_source": "estimated",
    "notes": "膳食纤维暂按 0 g；净碳水按总碳水计算；BMR≈1822（Katch-McArdle，按当日体重与最近体脂）。TDEE 的活动部分按训练容量估算 450 kcal（584 + 0.01×容量，由 58 天全天实测拟合）；未手工录入实测值。"
  },
  "nutrition": [],
  "workout": {
    "session_id": "day-116-xunji",
    "workout_name": "训记训练",
    "workout_type": null,
    "duration_minutes": 103.1,
    "active_energy_kcal": 286.0,
    "apple_health_workout_kcal": null,
    "notes": "训练动作来自训记 API；有氧消耗取 sets[].metrics.calories。课次 note 的 calorie 值为苹果健康训练时段消耗，仅记录不参与计算。",
    "exercises": []
  },
  "review": [
    {
      "review_status": "approved",
      "note": "用户确认纤维按 0 g、净碳水等于总碳水，并接受 TDEE 估算。",
      "field": "daily_log"
    }
  ]
}
