{
  "protocol_version": "1.0",
  "export_id": "day-108",
  "history_version": 4,
  "exported_at": "2026-10-09T07:22:41.804192Z",
  "date": "2026-10-07",
  "day_number": 108,
  "provenance": {
    "source": "xunji_app",
    "confidence": "high",
    "notes": "数据来自训记 Open API；膳食纤维按 0 g，净碳水按总碳水；TDEE 为估算值。"
  },
  "body": null,
  "daily_log": {
    "is_training_day": false,
    "workout_type": null,
    "calories_in": 1423.5,
    "tdee": 2270.0,
    "calorie_balance": -846.5,
    "protein_g": 139.76000000000002,
    "total_carbs_g": 144.845,
    "fiber_g": 0,
    "net_carbs_g": 144.845,
    "fat_g": 29.843,
    "steps": null,
    "active_energy_kcal": 450.0,
    "active_energy_source": "estimated",
    "notes": "膳食纤维暂按 0 g；净碳水按总碳水计算；BMR≈1822（Katch-McArdle，按当日体重与最近体脂）。TDEE 的活动部分按训练容量估算 450 kcal（584 + 0.01×容量，由 58 天全天实测拟合）；未手工录入实测值。"
  },
  "nutrition": [
    {
      "entry_id": "D108_XJ001",
      "meal_type": "morning",
      "food_name": "红薯",
      "brand": null,
      "amount": 80.0,
      "unit": "g",
      "servings": null,
      "calories": 91.0,
      "protein_g": 1.7,
      "total_carbs_g": 21.3,
      "fiber_g": 0,
      "net_carbs_g": 21.3,
      "fat_g": 0.11,
      "notes": "训记 API 营养快照；纤维未由接口返回。"
    },
    {
      "entry_id": "D108_XJ002",
      "meal_type": "morning",
      "food_name": "WPC80 蛋白粉",
      "brand": null,
      "amount": 40.0,
      "unit": "g",
      "servings": null,
      "calories": 418.0,
      "protein_g": 84.5,
      "total_carbs_g": 6.4,
      "fiber_g": 0,
      "net_carbs_g": 6.4,
      "fat_g": 7.4,
      "notes": "训记 API 营养快照；纤维未由接口返回。"
    },
    {
      "entry_id": "D108_XJ003",
      "meal_type": "morning",
      "food_name": "Oarmilk吾岛 吾岛零脂无蔗糖希腊酸奶",
      "brand": null,
      "amount": 100.0,
      "unit": "g",
      "servings": null,
      "calories": 63.0,
      "protein_g": 11.0,
      "total_carbs_g": 4.5,
      "fiber_g": 0,
      "net_carbs_g": 4.5,
      "fat_g": 0.0,
      "notes": "训记 API 营养快照；纤维未由接口返回。"
    },
    {
      "entry_id": "D108_XJ004",
      "meal_type": "morning",
      "food_name": "虾",
      "brand": null,
      "amount": 150.0,
      "unit": "g",
      "servings": null,
      "calories": 98.0,
      "protein_g": 19.6,
      "total_carbs_g": 3.0,
      "fiber_g": 0,
      "net_carbs_g": 3.0,
      "fat_g": 0.9,
      "notes": "训记 API 营养快照；纤维未由接口返回。"
    },
    {
      "entry_id": "D108_XJ005",
      "meal_type": "morning",
      "food_name": "大希地 鸡排鸡胸肉",
      "brand": null,
      "amount": 250.0,
      "unit": "g",
      "servings": null,
      "calories": 118.0,
      "protein_g": 13.4,
      "total_carbs_g": 12.2,
      "fiber_g": 0,
      "net_carbs_g": 12.2,
      "fat_g": 1.6,
      "notes": "训记 API 营养快照；纤维未由接口返回。"
    },
    {
      "entry_id": "D108_XJ006",
      "meal_type": "morning",
      "food_name": "大米",
      "brand": null,
      "amount": 50.0,
      "unit": "g",
      "servings": null,
      "calories": 367.0,
      "protein_g": 8.4,
      "total_carbs_g": 77.6,
      "fiber_g": 0,
      "net_carbs_g": 77.6,
      "fat_g": 1.0,
      "notes": "训记 API 营养快照；纤维未由接口返回。"
    },
    {
      "entry_id": "D108_XJ007",
      "meal_type": "morning",
      "food_name": "鸡蛋",
      "brand": null,
      "amount": 165.0,
      "unit": "g",
      "servings": null,
      "calories": 134.0,
      "protein_g": 12.6,
      "total_carbs_g": 2.3,
      "fiber_g": 0,
      "net_carbs_g": 2.3,
      "fat_g": 8.3,
      "notes": "训记 API 营养快照；纤维未由接口返回。"
    },
    {
      "entry_id": "D108_XJ008",
      "meal_type": "noon",
      "food_name": "江中食疗 江中猴菇",
      "brand": null,
      "amount": 30.0,
      "unit": "g",
      "servings": null,
      "calories": 505.0,
      "protein_g": 7.3,
      "total_carbs_g": 70.5,
      "fiber_g": 0,
      "net_carbs_g": 70.5,
      "fat_g": 21.5,
      "notes": "训记 API 营养快照；纤维未由接口返回。"
    },
    {
      "entry_id": "D108_XJ009",
      "meal_type": "noon",
      "food_name": "Galil 栗子仁",
      "brand": null,
      "amount": 80.0,
      "unit": "g",
      "servings": null,
      "calories": 153.0,
      "protein_g": 4.4,
      "total_carbs_g": 27.5,
      "fiber_g": 0,
      "net_carbs_g": 27.5,
      "fat_g": 1.0,
      "notes": "训记 API 营养快照；纤维未由接口返回。"
    }
  ],
  "workout": null,
  "review": [
    {
      "review_status": "approved",
      "note": "用户确认纤维按 0 g、净碳水等于总碳水，并接受 TDEE 估算。",
      "field": "daily_log"
    }
  ]
}
