{
  "protocol_version": "1.0",
  "export_id": "day-093",
  "history_version": 3,
  "exported_at": "2026-09-24T06:10:07.671114Z",
  "date": "2026-09-22",
  "day_number": 93,
  "provenance": {
    "source": "xunji_app",
    "confidence": "high",
    "notes": "数据来自训记 Open API；膳食纤维按 0 g，净碳水按总碳水；TDEE 为估算值。"
  },
  "body": {
    "weight_kg": 78.2,
    "notes": "训记 Open API 身体数据。"
  },
  "daily_log": {
    "is_training_day": false,
    "workout_type": null,
    "calories_in": 277.5,
    "tdee": 2280.0,
    "calorie_balance": -2002.5,
    "protein_g": 48.00000000000001,
    "total_carbs_g": 18.0,
    "fiber_g": 0,
    "net_carbs_g": 18.0,
    "fat_g": 1.5000000000000002,
    "steps": null,
    "active_energy_kcal": 450.0,
    "active_energy_source": "estimated",
    "notes": "膳食纤维暂按 0 g；净碳水按总碳水计算；BMR≈1826（Katch-McArdle，按当日体重与最近体脂）。TDEE 的活动部分按训练容量估算 450 kcal（584 + 0.01×容量，由 58 天全天实测拟合）；未手工录入实测值。"
  },
  "nutrition": [
    {
      "entry_id": "D093_XJ001",
      "meal_type": "morning",
      "food_name": "OIKOS Triple Zero",
      "brand": null,
      "amount": 150.0,
      "unit": "g",
      "servings": null,
      "calories": 58.666666666666664,
      "protein_g": 10.0,
      "total_carbs_g": 4.666666666666666,
      "fiber_g": 0,
      "net_carbs_g": 4.666666666666666,
      "fat_g": 0.0,
      "notes": "训记 API 营养快照；纤维未由接口返回。"
    },
    {
      "entry_id": "D093_XJ002",
      "meal_type": "morning",
      "food_name": "Muscle Milk Pro33g",
      "brand": null,
      "amount": 325.0,
      "unit": "g",
      "servings": null,
      "calories": 58.307692307692314,
      "protein_g": 10.153846153846157,
      "total_carbs_g": 3.384615384615385,
      "fiber_g": 0,
      "net_carbs_g": 3.384615384615385,
      "fat_g": 0.4615384615384616,
      "notes": "训记 API 营养快照；纤维未由接口返回。"
    }
  ],
  "workout": {
    "session_id": "day-093-xunji",
    "workout_name": "训记训练",
    "workout_type": null,
    "duration_minutes": 76.1,
    "active_energy_kcal": 186.0,
    "apple_health_workout_kcal": null,
    "notes": "训练动作来自训记 API；有氧消耗取 sets[].metrics.calories。课次 note 的 calorie 值为苹果健康训练时段消耗，仅记录不参与计算。",
    "exercises": []
  },
  "review": [
    {
      "review_status": "approved",
      "note": "用户确认纤维按 0 g、净碳水等于总碳水，并接受 TDEE 估算。",
      "field": "daily_log"
    }
  ]
}
