{
  "protocol_version": "1.0",
  "export_id": "day-011",
  "history_version": 1,
  "exported_at": "2026-08-16T18:35:09.691642Z",
  "date": "2026-07-02",
  "day_number": 11,
  "provenance": {
    "source": "chat_history",
    "confidence": "low",
    "notes": "日期根据 Day 43 = 2026-08-03 且期间连续无中断推算为 2026-07-02；日期已按连续无中断记录确认。"
  },
  "body": {
    "weight_kg": 81.05,
    "waist_cm": 87,
    "body_fat_percentage": null,
    "notes": "腰围沿用 Day 8 的最近测量值：87 cm。"
  },
  "daily_log": {
    "is_training_day": true,
    "workout_type": "core",
    "calories_in": 1886,
    "tdee": 2200,
    "calorie_balance": -314,
    "protein_g": 150,
    "total_carbs_g": 178,
    "fiber_g": 0,
    "net_carbs_g": 178,
    "fat_g": 61,
    "steps": null,
    "active_energy_kcal": 320,
    "notes": "核心训练；具体动作和组数待补充。TDEE 为预估值。Active Energy 待更新。；Active Energy 手动补录：320 kcal；nutrition_history.json 逐项饮食明细已补充；膳食纤维暂按 0 g。"
  },
  "nutrition": [
    {
      "entry_id": "D011_F001",
      "meal_type": "morning",
      "food_name": "Oikos Triple Zero",
      "brand": null,
      "amount": 2,
      "unit": "custom",
      "servings": null,
      "calories": 90,
      "protein_g": 15,
      "total_carbs_g": 7,
      "fiber_g": 0,
      "net_carbs_g": 7,
      "fat_g": 0,
      "notes": "原始单位：cup"
    },
    {
      "entry_id": "D011_F002",
      "meal_type": "morning",
      "food_name": "Premier Protein Shake",
      "brand": null,
      "amount": 1,
      "unit": "bottle",
      "servings": null,
      "calories": 170,
      "protein_g": 30,
      "total_carbs_g": 5,
      "fiber_g": 0,
      "net_carbs_g": 5,
      "fat_g": 3,
      "notes": null
    },
    {
      "entry_id": "D011_F003",
      "meal_type": "morning",
      "food_name": "香蕉",
      "brand": null,
      "amount": 1,
      "unit": "piece",
      "servings": null,
      "calories": 105,
      "protein_g": 1.3,
      "total_carbs_g": 27,
      "fiber_g": 0,
      "net_carbs_g": 27,
      "fat_g": 0.3,
      "notes": null
    },
    {
      "entry_id": "D011_F004",
      "meal_type": "morning",
      "food_name": "全脂牛奶（Latte）",
      "brand": null,
      "amount": 200,
      "unit": "g",
      "servings": null,
      "calories": 61.5,
      "protein_g": 3.2,
      "total_carbs_g": 4.8,
      "fiber_g": 0,
      "net_carbs_g": 4.8,
      "fat_g": 3.3,
      "notes": null
    },
    {
      "entry_id": "D011_F005",
      "meal_type": "noon",
      "food_name": "油浸 Tuna",
      "brand": null,
      "amount": 1,
      "unit": "custom",
      "servings": null,
      "calories": 140,
      "protein_g": 23,
      "total_carbs_g": 0,
      "fiber_g": 0,
      "net_carbs_g": 0,
      "fat_g": 5,
      "notes": "原始单位：can"
    },
    {
      "entry_id": "D011_F006",
      "meal_type": "noon",
      "food_name": "Ciabatta",
      "brand": null,
      "amount": 1,
      "unit": "piece",
      "servings": null,
      "calories": 210,
      "protein_g": 7,
      "total_carbs_g": 41,
      "fiber_g": 0,
      "net_carbs_g": 41,
      "fat_g": 1.5,
      "notes": null
    },
    {
      "entry_id": "D011_F007",
      "meal_type": "noon",
      "food_name": "Mexican Style Street Corn",
      "brand": null,
      "amount": 90,
      "unit": "g",
      "servings": null,
      "calories": 117.65,
      "protein_g": 3.53,
      "total_carbs_g": 18.82,
      "fiber_g": 0,
      "net_carbs_g": 18.82,
      "fat_g": 3.53,
      "notes": null
    },
    {
      "entry_id": "D011_F008",
      "meal_type": "night",
      "food_name": "猪排骨",
      "brand": null,
      "amount": 200,
      "unit": "g",
      "servings": null,
      "calories": 250,
      "protein_g": 19,
      "total_carbs_g": 0,
      "fiber_g": 0,
      "net_carbs_g": 0,
      "fat_g": 19,
      "notes": null
    },
    {
      "entry_id": "D011_F009",
      "meal_type": "night",
      "food_name": "百叶结",
      "brand": null,
      "amount": 50,
      "unit": "g",
      "servings": null,
      "calories": 70,
      "protein_g": 7,
      "total_carbs_g": 4,
      "fiber_g": 0,
      "net_carbs_g": 4,
      "fat_g": 3,
      "notes": null
    },
    {
      "entry_id": "D011_F010",
      "meal_type": "night",
      "food_name": "Mexican Style Street Corn",
      "brand": null,
      "amount": 100,
      "unit": "g",
      "servings": null,
      "calories": 117.65,
      "protein_g": 3.53,
      "total_carbs_g": 18.82,
      "fiber_g": 0,
      "net_carbs_g": 18.82,
      "fat_g": 3.53,
      "notes": null
    },
    {
      "entry_id": "D011_F011",
      "meal_type": "night",
      "food_name": "生米",
      "brand": null,
      "amount": 50,
      "unit": "g",
      "servings": null,
      "calories": 360,
      "protein_g": 7.6,
      "total_carbs_g": 78,
      "fiber_g": 0,
      "net_carbs_g": 78,
      "fat_g": 0.6,
      "notes": null
    },
    {
      "entry_id": "D011_F012",
      "meal_type": "snack",
      "food_name": "西瓜",
      "brand": null,
      "amount": 200,
      "unit": "g",
      "servings": null,
      "calories": 30,
      "protein_g": 0.6,
      "total_carbs_g": 7.6,
      "fiber_g": 0,
      "net_carbs_g": 7.6,
      "fat_g": 0.15,
      "notes": null
    },
    {
      "entry_id": "D011_F013",
      "meal_type": "snack",
      "food_name": "Premier Protein Shake",
      "brand": null,
      "amount": 1,
      "unit": "bottle",
      "servings": null,
      "calories": 170,
      "protein_g": 30,
      "total_carbs_g": 5,
      "fiber_g": 0,
      "net_carbs_g": 5,
      "fat_g": 3,
      "notes": null
    }
  ],
  "workout": null,
  "review": [
    {
      "review_status": "needs_review",
      "note": "训记 API 未返回该日期的训练动作；仍需手工补充核心训练明细。",
      "field": "workout.exercises"
    },
    {
      "review_status": "approved",
      "note": "日期已按 Day 43 = 2026-08-03 且期间连续无中断记录确认。",
      "field": "day.date"
    },
    {
      "review_status": "approved",
      "note": "逐项饮食明细已从 nutrition_history.json 补充；已保留原有确认值。",
      "field": "daily_log.nutrition"
    }
  ]
}
